he told me that my car wheel was wobbling something awful	esan zidan nire auto-gurpila zerbait beldurgarria txikitzen ari zela
this morning I got up half awake and staggered around.	gaur goizean, erdi esna jaiki nintzen, inguruan mailakatuta.
I haven't yet fetched my grandfather's burro back for him.	Oraindik ez dut aitonaren astoa beretzat berreskuratu.
the medicine man sprayed medicine on me	medikuntza-gizakiak medikuntza ihinztatu zuen nigan
in the morning I spray my hair with a hair spray	goizean, ilea lainoztatu egiten dut, ile-spray batekin
"I saw him ""herding"" his children around at the fair"	"Seme-alabak "larratzen" ikusi nituen azokaren inguruan"
I saw him driving his chickens around	Inguruko oilaskoak gidatzen ikusi nuen
reach --- a level.)	irismena -- maila bat).
I find that it has already melted off on the rock	Dagoeneko arrokan urtua den topaketa
I wish the snow would hurry and melt	Elurra presurtzea eta urtzea nahi dut
when it snows the sunny hillsides are the first to melt off.	hegal eguzkitsuak elurtu zituenean, lehenak dira urtzen.
when the wind swirls around	haizea inguruan biraka dabilenean
the little boy has his sock on inside out.	umeak galtzerdiak barrurantz ditu.
as soon as it starts to rain the bees swarm back into their hive	erleak euria hasi bezain laster, bere erlauntzean sartu dira berriro
my grandfather still has a good set of teeth despite the fact that he is seventy years old	aitonak oraindik ere hortz asko ditu, hirurogeita hamar urte baditu ere.
at school I took part in the dissection of a frog	eskolan igel baten disekzioan parte hartu nuen
there was a nice rain and afterward the grass greened back up	Euri atsegina zegoen eta gero belarra berde bihurtu zen
to fall back into the water	berriro uretara erortzea
I keep sewing my moccasin	Nire moccasina josten jarraitzen dut
I vomited when I drank juniper tea	Vomité, ipuru-tea edan nuenean
"last night I drank a lot of beer and when I got home I ""tossed my cookies""."	"anoche garagardo asko edan nuen eta etxera iritsi nintzenean "gailetak bota nituen""."
to take them back into town	hirira itzultzeko
I bought fifteen ewes from the sheep sale in Farmington but four were no good so I took them back	Farmingtonen ardi-salmentako hamabost ardi erosi nituen, baina lau ez ziren onak eta itzuli egin nituen
to re-bury them	berriz lurperatzeko
I took out the prairie dogs I had in the ashes but I found out that they weren't done so I put them back	Errautsetan nengoen zelaitik atera nituen txakurrak, baina konturatu nintzen ez zeudela horrela eginda, itzuli egin nintzen
last year my grandfather lost his eyesight	iaz aitonak ikusmena galdu zuen
our grandfather passed away last year at this time	gure aitona iaz hil zen
plug chewing tobacco	mastekatzeko tabakoa estaltzea
chewing tobacco	tabakoa mastekatzea
big tobacco	tabako handia
marijuana cigarette	marihuana zigarroa
marijuana cigarette.	marihuana-zigarroa.
cigarettes cost two cents each	zigarro bakoitzak bi zentimo balio du
goats were reportedly distributed at the rate of five to each person	ahuntzak bosna laguni banatu zitzaizkien
I helped sack potatoes at twelve cents a sack	Hamabi zentaboko zakuan patatak ateratzen lagundu dut
each horse is said to eat five times as much as a sheep per year	zaldi bakoitzak esaten du urtean ardi bat adina bost aldiz jaten duela
I set the paper right under his nose but he didn't see it.	Papera sudurraren azpian jarri nuen, baina hark ez zuen ikusi.
some girls like to dance in the circle dance	neska batzuek biribilean dantzatzea gustatzen zaie
last night we danced the circle dance with Plains Indians.	anoche, zirkuluko dantza Indios Llanerosekin.
the sheep corral is big	ardi-eskorta handia da
there's a woven wire pen for the chickens.	munduratutako alanbrezko arkatz bat dago oilaskoentzat.
a War Dance was held ten days ago at Mr. Long's place.	War Dance duela hamar egun ospatu zen Long jaunaren tokian.
at noon I put out food for the school children.	eguerdian bazkaria atera nuen eskolako umeentzat.
there's a lot of bottles scattered along the highway.	botila asko daude sakabanatuta errepidean.
as I followed along in my father's footsteps he suddenly stopped and I ran into him	aitaren urratsei jarraituz segitu nuenez, bat-batean gelditu eta berarekin topo egin nuen.
that big building over there has lots of rooms.	eraikin handi bat gela pilo baten gainean dagoela.
zipper shirt	kremailera-atorra
zipper coat	Kremailera-berokia
zipper purse or billfold.	Kremailera- edo biltze-poltsa.
the elephant got up with me and started off	elefantea nirekin altxatu zen eta
at the meeting we took a standing vote on the road improvement matter.	bilera horretan etengabeko botoa eman genuen errepideak hobetzeari buruz.
I hung up the gun but it fell off	Arma zintzilikatu nuen, baina itzalita erori zen
your license plate is about to fall off	zure lizentzia-plaka erortzear dago
work on the dam will commence next month	presaren gaineko lana datorren hilean hasiko da
a sandpainting was begun immediately upon the arrival of the medicine man	sandpainting bat medikuntza-gizakia iritsi eta berehala hasi zen
I hung up the saddle but it fell off	Jarlekua zintzilikatu nuen, baina itzalita erori zen
my heel came off as I was playing ball	nire orpoa pilota jokatzen ari zen bezala atera zen
I've lost one of my heels	Orpoetako bat galdu dut
I had put my hat on a tree but it came detached and fell	Nik kapela zuhaitz batean jarri nuen, baina ardoa bereizirik, eta erori egin zen
when my car broke down on me my father started to tow me back but his own car broke down on him.	nire autoa hautsi zitzaidanean, aita atzetik abiatu zen, baina autoa hautsi egin zen.
we with it	gu berarekin
I took off my clothes to take a swim when a woman on horseback came up over the hill nearby.	Arropa kendu eta inguruko muinoan emakume bat zaldiz igo zenean bainu bat hartu nuen.
whenever my mother goes away some- where I start to fool around with her loom	nire ama joaten denean - non bere ehunarekin engainatzen hasten naiz
I struck at the ball but missed it	Bolan jo nuen, baina galdu egin nuen
I had to put the firewood on a stump before I could pick it up on my back	Egurra eskumuturrean jarri behar izan nuen bizkarrean jaso aurretik
chop.)	chop.)
when I hit my little brother with a ball he started to cry	nire anaia txikia negarrez hasi zen pilota batekin jo nuenean
I was pounding out pinon nuts when I hit my finger	Intxaurrak jotzen ari nintzela, pinoia jo nuen hatza jo nuenean
when I was herding with my older sister I ran off and went back home before she could do anything to me.	Nire ahizpa zaharrenarekin lanean ari nintzela, ihes egin eta etxera itzuli nintzen, hark niretzat edozer egiteko aukera izan baino lehen.
we took down the window curtains and started to wash them	leihoko gortinak jaitsi eta garbitzen hasiko gara
to unhitch the horses from the wagon (Lit. to take them down alongside the wagon	zaldiko-maldikoa askatzeko (Lit. orgaren ondoan behera eramateko
he unhitched the horses from the wagon and gave them some hay	Zaldiak gurditik askatu eta belar bat eman zien
this little boy can take his own trousers	haur honek bere galtzak har ditzake
we all laughed at our boss and he got sore about it	denok barre egiten diogu gure nagusiari, eta bera haserretu egin zen
this morning my father got me up when he got up	goizean, aitak jaiki egin nau jaikitzean
get me up in the morning at six o'clock.	jaiki zaitez goizean seietan.
I untethered the dog from the tree	Igurtzi zuhaitzeko txakurra
I was taken down from the bunk bed.	Itsasertzetik behera eraman ninduten.
I picked a banana and ran off with it	Banana bat aukeratu eta berarekin ihes egin nuen
I scooped up some ice cream with my bare hand but my older sister says that's not nice	Izozki pixka bat aukeratu nuen esku biluziarekin, baina nire ahizpa nagusiak dio ez dela atsegina.
a boy took my hat and ran off with it so I took after him and took it back	mutil batek kapela hartu eta korrika egin zuen harekin, eta gero hartu eta itzuli egin zen.
when the boys were boxing one of them was hit in the groin and he collapsed as a result of it.	mutiletako bat boxeatzen ari zela, izterrondoan jo eta erori egin zen.
I took down the shawl for my mother.	Amarentzat hartu nuen txala.
I picked up my check this morning.	Nire txekea jaso nuen gaur goizean.
my father grabbed the rope away from me just as I was in the act of hitting the burro with it.	aitak soka nigandik urrun hartu zuen, ni astoa harekin jotzeko egintzan nengoen bezala.
the trader takes off from the road in his plane.	traderra errepidetik abiatu da hegazkinean.
yesterday two white men came to see us	atzo bi gizon zuri etorri ziren gu ikustera
my grandmother's sore feet continue to bother her	amonaren oin mingarriek gogaitzen jarraitzen dute
it took longer than expected to repair the tire	espero baino denbora gehiago hartu zuen pneumatikoa konpontzeko
when we got back to Gallup we were stranded there and didn't get back home for two days	Gallupera itzuli ginenean, han geratu ginen, eta bi egunez ez ginen etxera itzuli.
I cut my fingernails and they grew back out in no time.	Azazkalak moztu eta laster atera ziren berriro.
I paced off the distance between my mother's hogan and mine because I wondered how many feet there were	Amaren eta nire familiaren arteko distantziatik atera nintzen, zenbat oin zeuden galdetu bainion
I sat down and put my feet on the table	Eseri eta oinak mahaian jarri nituen
I sang eight songs for my grandfather as he rested	Zortzi abesti kantatu nituen aitonarentzat atseden hartzen ari nintzela
last night my uncle sang the hogan song	anoche mi osabak hogan kanta abestu zuen
I ate too much last Sunday when I took the family to the mountains.	Gehiegi jan nuen joan den igandean familia mendira eraman nuenean.
darned if I didn't go to sleep myself as I sat rocking the baby	haurra astintzen ari nintzela ni neu lotara joaten ez banintz
my sister is rocking her feet and head back and forth as she listens to the music.	nire ahizpa oinak eta joan-etorriko burua mugitzen ari da musika entzuten duen bitartean.
I hid my younger brother's ball outdoors in the snow.	Nire anaia gaztearen bola ezkutatu nuen elurretan aire zabalean.
I lost count when I was half way through counting the lambs.	Arkumeak kontatzean erdi bidean nengoela kontatzea galdu nuen.
I stepped on the chair	Aulkia zapaldu nuen
while setting posts for a fencc I stepped off twelve paces between them	fencc batentzat zutoinak jartzen ari nintzela, hamabi urrats egin nituen bien artean
I stepped off two hundred paces from my home to the sheep corral	Berrehun urrats atera nituen nire etxetik ardi-eskortara
he's swinging the baby	umea balantzaka ari da
don't swing him so hard!	ez kulunkatu hain gogorra!
my mother caught me as I started to creep around in the greasewood.	nire amak harrapatu ninduen greasewood-ean arrastaka hasi nintzenean.
I play golf in Farmington on Sunday.	Golf jokoa Farmingtonen igandean.
if you can think and act faster than I can you'll finish it before me	ahal baino azkarrago pentsatu eta jardun badezakezu, nire aurretik bukatuko duzu
my father thinks quickly	aitak azkar pentsatzen du
when I was far away my mother waved at me	urrun nengoela, amak agur egin zidan
the baby waved at me when I left	haurtxoa joan nintzenean agurtu ninduen
I raised my kitten with care	Nire katutxoa kontuz hazi nuen
my grandmother raised me with great care	nire amonak kontu handiz hazi nintzen
my boss gave me hell for missing work yesterday	nire nagusiak infernua eman zidan atzo lanik ez zegoelako
my mother really got after me for breaking her dish.	amak nire atzetik lortu zuen, platera apurtzeko.
the dog twitches in his sleep	txakurra bere ametsetan sartu da
at the age of fifteen months I started to talk.	hamabost hilabete nituela hasi nintzen hitz egiten.
last winter when it snowed and I went up hill in my car the wheels really spun.	joan den neguan, elurra egin eta nire autoan muinoa igo nuenean, gurpilek irribarre egiten dute.
there are many valleys on the mountaintop.	bailara asko daude mendiaren gailurrean.
our gas ran out just before we got to his place	gure gasa bere lekura iritsi aurretik atera zen
the cigarettes will not last until I get back.	zigarretek ez dute iraungo itzuli arte.
the War Dance is not something that is taken lightly.	Gerraren Dantza ez da pixka bat hartzen dena.
I'll come back to see you in the future	Berriro ikusiko dut etorkizunean
no one can tell what the future may hold.	inork ezin du esan etorkizunak zer eduki dezakeen.
the man lead the horse on with some hay and finally tricked it into going into the fenced area	gizonak zaldia piztuta eramaten du belar pixka batekin, eta, azkenik, engainatu egiten du inguratutako eremura joaten.
wren	warea
I wonder what I looked like when I was little	Gutxi nintzenean nola iruditzen zitzaidan galdetzen diot neure buruari
I was dawdling along the road when I found a nice arrowhead.	Bidean dawdling zegoen, arrowhead on bat aurkitu nuenean.
I don't have what it takes for this job	Ez dut lan honetarako behar dena
Mr. Long can't support his family	Long jaunak ezin dio familiari lagundu
I need a small tractor but I can't affort it	Traktore txiki bat behar dut, baina ezin dut bera hil
cactus fruit.	fruta-kaktusa.
cattle guard.	azienda zaintza.
one hundred times	ehun aldiz
one hundred and one	ehun eta bat
two hundred	berrehun
thréé hundred	Ehun
four hundred	laurehun
five hundred	bostehun eta bostehun
six hundred	seiehun eta seiehun
seven hundred	zazpiehun
eight hundred	zortziehun eta zortziehun
nine hundred	bederatziehun eta bederatziehun eta bederatziehun
last summer my mother saved a lot of squash seeds	iragan udan amak kalabaza-hazi asko salbatu zituen
I broke up a box and made a fire with it.	Kaxa bat hautsi eta su bat egin nuen harekin.
I'm sitting stripping the peel off the green chiles	Eserita nago txil berdeen oskola biluzten
he little boy tore up my newspaper	haur txikiak nire egunkaria urratu du
my girlfriend wrote me a letter but I tore it up and threw it into the fire	andregaiak gutun bat idatzi zidan, baina toreatu eta sutan bota nuen.
this machine is to slice bread with.	makina hau ogia honekin ebakitzea da.
last night in the middle of the night the dog started to bark at something	anoche gauerdian txakurra zerbait lapurtzen hasi zen
the dogs	zakurrak
I drank up two bottles last night and now I have an awful hangover	Bi botila anoche edan nituen eta orain ajea izugarria dut
I got terribly hungry out herding	Herding-gosea daukat ikaragarri
the dog is barking at me	txakurra zaunka ari da
I expected my father all night but he didn't come	Aita gau osoan espero nuen, baina ez zen etorri
I expected you last night but you didn't come	Zure zain zeunden, baina ez zinen etorri
I suspect him of killing my cow	Susmoa dut behia hil zuela
I suspected this man of having an affair with my wife	Gizon honek emaztearekin kontu bat zuela uste nuen
last night I dreamed that we had a big snow.	elur handia genuela amets egin nuen.
you have a horse.	zaldi bat duzu.
Bottom of the World	Munduko Funtsa
Red World	Mundu gorria
Dark World	Mundu iluna
White World (mythology	Mundu zuria (mitologia
Yellow World	Mundu horia
Glittering World	Mundu distiratsua
my late grandmother's home was right here	amonaren etxe zendua hemen zegoen
I remember that my younger brother had set out for town.	Gogoan dut nire anaia txikia hirira atera zela.
a legislator named Lucero refused to resign his office in the New Mexico Legislature	Lucero izeneko legegile batek uko egin zion bere karguari Mexiko Berriko Legegintzaldian.
I lived in a tent last summer	Joan den udan denda batean bizi nintzen
I came down by parachute	Jausgailuaz egindako ardoa
tomatoes are always the first to be killed by frost	tomateak izozteengatik hiltzen dituzten lehenak dira beti.
"I see that my corn ""got it"" last night."	"Ikusten dut nire artoak ""lortu zuela"""""", atzo."
we relatives went	senideak izan
they went up to the canyon's edge one after another and looked down into the canyon	kanoiaren ertzera igo ziren bata bestearen atzetik, eta kanoira begiratu zuten.
on our way to Fort Sumner we crossed a river with great hardship	Fort Sumnerrerako bidean zailtasun handiak dituen ibai bat gurutzatuko dugu
we ambushed the Japanese from behind the building	Japoniarrak eraikinaren atzetik sartzen ditugu
this man stole my horse and I'll give him ten days to pay me for it	gizon honek zaldia lapurtu zuen eta hamar egun emango dizkiot harengatik ordaintzeko.
the Fair came to an end	Azoka amaitu egin zen
the two returned to earth.	biak itzuli ziren lurrera.
the rain didn't reach us yesterday	euria ez zitzaigun atzo iritsi
about thirty years ago the period during which the Navajos had large herds of sheep came to an end	duela hogeita hamar urte amaitu zen Navajosek artalde handiak zituzten garaia.
yesterday my grandmother rode to our place by wagon and from there we took her to town in the car.	atzo amonak gurdian sartu zuen gure lekua, eta handik hirira eraman genuen autoan.
one of us will go there	gutako bat hara joango da
nowadays many of you teachers are Navajos.	gaur egun irakasle asko Navajos dira.
I started to work with the tractor as soon as it warmed up	Berotu bezain laster hasi nintzen traktorearekin lanean
we were served food as we stood in a row one behind another.	janaria zerbitzatu ziguten, lerro batean bata bestearen atzetik gelditu ginen bitartean.
it is said that we lived nicely before Columbus	esaten da oso ondo bizi garela Kolonen aurretik
I found that the gun was cocked when I picked it up.	Pistola jaso nuenean laberatu zutela ikusi nuen.
we'll cross the river by boat	ibaia itsasontziz zeharkatuko dugu
my hen lays eggs everyday	nire oiloak egunero erruten ditu arrautzak
when my hen was young she laid an egg every other day	nire oiloa gaztea zenean, arrautza bat jarri zuen egunero
having filled a sack with corn I started off lugging it on my back but my knees	zaku bat artoz bete ondoren, bizkarrean lugging egiten hasi nintzen, baina nire belaunak
I got a sore on my hand when I burned it and now there is a crust on it	Llaga bat daukat nire eskuan erre nuenean, eta orain azal bat dago.
there is a heavy stand of pine timber on the Navajo Reservation	pinu-egurraren euskarri astun bat dago Navajo erreserban
I rode the horse as far as the wash	Zaldia garbitu arte muntatu nuen
yesterday the car stalled on me	atzo autoa pilotatu zidan
I made a short stop in Gallup en route to Flagstaff	Geldialdi labur bat egin nuen Gallupen, Flagstaff-erako bidean
this man was charged with assault with a deadly weapon	arma hilgarri batekin eraso egin izana leporatu zioten gizon horri.
I see that my car tire went down last night	Ikusten dut nire autoko pneumatikoa jaitsi egin zela
I ran out of sight before they saw me	Ikusi gabe geratu nintzen ikusi baino lehen
I took off fast when my little brother doubled his fist	Azkar hasi nintzen, anaia txikiak bere ukabila bikoiztu zuenean
I folded the bill and put it in my pocket	Faktura bikoiztu eta nire poltsikoan jarri nuen
what delayed you?	zer atzeratu zitzaizun?
the little boys are making snowballs with their hands and throwing them at one another	haur txikiak elur-bolak egiten ari dira beren eskuekin, eta elkarri botatzen ari dira.
tomorrow I'll help my father roll up the barbed wire	bihar lagunduko diot aitari alanbre horia biltzen
when my mother spun the yarn I wound it into a ball for her	amak haria irabiatu zuenean bola batean zauritu nuen beretzat
I clenched my fist at him.	Nire ukabila estutu nion.
the boy warmed his hands up by blowing on them	mutilak eskuak goian berotu zituen haietan putz eginez
the training program has come to an end because Congress hasn't approved funds	prestakuntza-programa amaitu egin da, Kongresuak funtsik onartu ez duelako
the white man for whom I worked passed away last night.	lan egin nion gizon zuria hil egin zen.
the squash vine I planted grew twenty feet long	Kalabaza-mahatsak hogei oin luze hazi ziren.
when I tripped and fell my thumb was bent backwards and it broke.	estropezu egin eta erpurua erori zitzaidanean, atzerantz tolestu eta hautsi egin zen.
the high wind put out our fire last night	goi-haizeak gure sua itzali zuen
when I found that the coffee had gotten cold I put it back on the stove and drank it as soon as it got lukewarm.	kafea hoztu zela jakin nuenean, berogailuan jarri nuen berriro, eta epel jarri bezain laster edan nuen.
when I had a headache I took a pill and it stopped hurting.	buruko mina nuenean pilula bat hartu eta zauritzeari utzi nion.
the dog lies on the doorstep	txakurra atean dago
they say that a meteor	diote meteoro batek
my father put the wool into a bag and packed it down	aitak artilea poltsa batean jarri eta bete zuen
the baby has not yet started to walk	umea oraindik ez da ibiltzen hasi
the baby started to creep at the age of eight months.	umea zortzi hilabete zituela hasi zen negarrez.
I picked up a piece of firewood and hit it on the ground to get the snow off of it	Egur zati bat hartu eta lurrean kolpatu nuen, elurra kanpoan egiteko
I threw the pencil down and it broke.	Arkatza beherantz bota eta hautsi egin zen.
my daughter started to run about at the age of two years.	nire alaba bi urte zituela hasi zen korrika egiten.
I slammed my husband's liquor down on the ground	Nire senarraren likorea beherantz jo nuen lurrean
the old man got mad and slammed his hat down on the ground.	zaharra haserretu egin zen eta txapela lurrean jo zuen.
when the ball bounces outside of the line it goes to the other player	bola lerrotik kanpo errebotatzean, beste jokalariari
I borrowed my cousin's saddle and just kept it.	Lehengusuaren jarlekua hartu eta gorde egin nuen.
when I went down the canyon wall dangling on a rope I could barely touch the ground at the bottom	kanoiaren pareta soka batean zintzilik jaitsi nuenean, ia ezin nuen lurra ukitu beheko aldean.
I was dribbling the ball when it went flat on me	Bola dribbling nengoen, nire baitan laua izan zenean
I sit tapping my foot on the floor	Pisuan nire oina ukitzen sentitzen naiz
I'm sitting and bouncing two balls	Eserita nago eta bi bola bota
it started to rain this afternoon where I live	euria hasi du gaur arratsaldean, bizi naizen tokian
it looks like it's going to rain there on the flat	badirudi euria egingo duela han pisuan
I sprinkled water around in my hogan and swept	Ura zabaldu nuen inguruan nire etxean eta barrian
I scattered corn for the chickens.	Artoa zabaldu oilaskoentzat.
I lost my mouse-colored horse	Nire aho-koloreko zaldia galdu nuen
I melted the grease and set it in the window where it hardened	Gantza eta koloia gogortu zen leihoan fundatu nituen
we had a nice summer.	uda atsegina izan genuen.
this water is very clear	ur hori oso argia da
transparent.;	gardena. ;
violent rain	euri bortitza
a big rain is in progress	euri handi bat egiten ari da
there is rain in progress.	euria ari du.
this stream of sewage flows into a pipe and thereafter flows along inside of it	hondakin-uren korronte hori hodi batean jariatzen da, eta, ondoren, hodiaren barnean jariatzen da.
mashed potato.	patata-purea.'
my lambs have become nice and plump	nire arkumeak atseginak eta berunak dira
I had a spherical hogan built	Su esferiko bat egina zuen
a ball is round	bola bat biribila da
the moon too is round	Ilargia ere biribila da
Volkswagen Beetle	Volkswagen Interesa
the lamb was sick but I cured it by giving it medicine	arkumea gaixorik zegoen, baina sendatu egin nuen, medikuntza emanez
I'm paid nine thousand a year for my job.	Urtean bederatzi mila ordaintzen didate nire lanagatik.
I get my mail at Window Rock	Posta jasotzen dut Window Rock-en
we usually use my uncle's wagon for transportation to the mountains. Mine hasn't yet been used	normalean, osabaren bagoia erabiltzen dugu mendira joateko. Mine oraindik ez da erabili
my grandfather loaned us his wagon and yesterday we used it to go to the mountains for firewood	nire aitonak orga utzi zigun, eta atzo erabili genuen mendira egurrerako joateko
there's water down in the canyon but it's inaccessible. It can be reached only by wagon.	kanoian ura behean dago, baina ezin da sartu. Wagon bidez bakarrik irits daiteke.
we butchered a sheep and it lasted us three days	ardi bat hil genuen, eta hiru egun iraun zigun
I bought these good shoes ten years ago and they lasted a long time.	Duela hamar urte erosi nituen zapata on horiek, eta luzaroan iraun zuten.
the Navajos couldn't stand a man named Dana L. Shipley.	Navajosek ezin zuen jasan Dana L. Shipley izeneko gizon bat.
we herded the rams to water this morning.	Ahariak zauritu ditugu gaur goizean ureztatzeko.
I parked my car behind the meeting house last night	Anoche bilerako etxearen atzean aparkatu nuen nire autoa
I didn't rest until I had driven the car fifty miles	Ez nuen atsedenik hartu autoa berrogeita hamar miliara eraman arte
I was going to drive the car to the sheep corral but I found that the brakes don't work	Autoa ardi-eskortara eraman behar nuen, baina balaztek ez dutela funtzionatzen ikusi nuen.
I didn't rest until I had driven fifty miles	Ez nuen atsedenik hartu berrogeita hamar milia gidatu arte
when I entered the army I stored my car in town	armadan sartu nintzenean, nire autoa hirian biltegiratu nuen
last night I set a mousetrap	anoche tranpa jarri zitzaidan
it has been seconded	bigarren mailakoa izan da
there has not yet been a second on it	oraindik ez da egon segundo bat
my son caught a lamb for me	nire semeak arkumea hartu zuen niretzat
Mr. Long was accused of assaulting a girl who was out herding	Long jaunari herdingetik kanpo zegoen neska bati eraso egitea leporatu zioten
my grandfather died at the age of one hundred	nire aitona ehun urte zituela hil zen
I'll keep this paper as long as I live	Paper hau gordeko dut bizirik nagoen bitartean
I crept up to the edge of the canyon and lay in wait for a deer.	Arroilaren ertzeraino eraman nintzen eta orein baten zain egon nintzen.
