in thirty minutes we'll eat.	hogeita hamar minutu barru bazkalduko dugu.
I said thus).	esan nuen horrela).
is liquor legal for Indians here?	hemen indiarrentzako legezko likorea zara?
the prairie dog stuck his head up out of the hole and looked around quickly.	zelaiko zakurrak zulotik gora itsatsi zuen burua, eta ingurura begiratu zuen berehala.
we're getting low on gasoline	gasolina gutxitzen ari gara
our wood supply is going fast because of the cold weather	egur-hornidura azkar doa, klima hotza dela eta
our enemies all surrendered	gure etsai amorratuak
I was going to go with my cousin bur. I backed out	Nire lehengusu fundazioarekin joango nintzen. Kanporako kopia
it's quitting time now	orain denbora uztea
every Saturday my daughter runs off to a dance. I don't like it at all	larunbatero, nire alaba dantzaldi batera doa. Ez zait batere gustatzen
I bought a coat but I don't like it	Beroki bat erosi nuen, baina ez zait gustatzen
I have a fine dog	Txakur fina dut
I have a fine horse	Zaldi mehe bat daukat
I have a very nice wife	Oso emazte atsegina dut
this gun is dangerous.	arma hau arriskutsua da.
children like ice cream.	haurrak izozki gisa.
the trader spotted me as I was pushing the bicycle away from the trading post	trader-ek ikusi ninduen, saltokitik urrun, bizikleta bultzatzen ari zela
my older sister took her baby to town to have its picture taken	nire ahizpa zaharrenak hirira eraman zuen haurra argazkia ateratzeko
the little boy did as he was told	haurrak esan bezala egin zuen
to say terrible things to him	gauza beldurgarriak esateko
my wife said terrible things to me last night	emazteak gauza beldurgarriak esan zizkidan Anoche
when I was playing football with my little brother I butted him over on his back and he passed out	anaia txikiarekin futbolean ari nintzela, bizkarrean jo nuen, eta bera kanpoan pasatu zen.
I kicked my dog into the garage and closed the door on him	Nire txakurra garajean patentatu eta atea bertan itxi nuen
I flicked a fly off the table top and it landed in the stew that my grandfather was eating	Euli bat egin nuen mahaitik kanpo eta nire aitona jaten ari zen gisatuan lurreratu zen.
there are deer tracks around here	orein-arrastoak daude hemen inguruan
they say that long ago the grass in the Navajo country was as high as a horse's belly.	diotenez, Navajo herrialdeko belarra zaldi baten sabela bezain handia zen aspaldi.
there's a trail. leading up the slope of the mountain.	bide bat dago. mendi-hegala igotzea.
the trader has a wart on the end of his nose.	trader-ek garatxo bat du sudurraren muturrean.
I screwed on the hinges	Bandetan torlojuz lotu nintzen
I ripped my skirt as I was getting down from the wagon	Nire hegala harraskatu nuen gurditik jaisten ari nintzela
I turned my ankle while getting off a horse	Zaldi batetik irteten ari nintzela itzuli nintzen orkatila
I went down into the canyon with my father and there we caught some fish	Aitarekin joan nintzen kanoira eta han arrain batzuk hartu genituen
when I made an arrow I put grooves in it as far as the butt	gezi bat egin nuenean, zirrikitu batzuk jarri nituen, atzeko alderantz
in making the bracelet I filed opposing rows of grooves in it	eskumuturrekoaren fabrikazioan arteka-lerro kontrajarriak aurkeztu nituen
I made a lot of baskets	Saski piloa egin nuen
we climb down into the canyon with a rope	soka batekin kanoira igo
I fixed my broken stirrup strap by piercing it with an awl and sewing it	Nire estribu-uhala finkatu nuen, awl batekin zulatu eta josi nuelako
I punched holes in the moccasin soles for my grandmother	Moccasin zoletan zuloak egin nituen amonarentzat
there is plenty of wild game in these mountains	jolas basati ugari dago mendi hauetan
when the school ball team went to Albuquerque evening overtook them in Gallup enroute back.	eskolako pilota-taldea Albuquerque noche joan zenean, Gallupen gainditu zituen, eta ibilbidera itzuli zen.
my burro ducks his head when ever someone puts a bridle on him	nire astoak burua jotzen du norbaitek balazta jartzen dionean
I got bored with herding all the time	Aspertu egiten naiz herdingarekin denbora guztian
I'm sick and tired of dishwashing	Gaixorik nago eta ontzi-garbigailuz nekatuta nago
when I made stew I put in salt and took a sip of it with a spoon	iluntzen nuenean, gatzetan jarri nintzen, eta hartatik sorbo bat hartu nuen koilara batekin
the giant threw a rock downward	erraldoiak harri bat bota zuen behera
my hat blew down into the gorge.	nire txapela behean putz egin zuen eztarrian.
we were teasing the bear cub when its mother became enraged at us	Ama guregan haserretu zenean, hartzaren kumeak iseka egiten ari ginen.
the goats were afraid of the wash so I pushed them down into it	ahuntzek beldurra zioten garbitzeari, eta beherantz bultzatu nituen
at that time the Navajos slipped away one after another with their sheep	une horretan, Navajos ardiekin irristatu zen bata bestearen atzetik.
I got bored sitting in the meeting so I simply started back home	Aspertuta nengoen bileran, eta etxera hasi nintzen
I'm listless; I don't feel like doing anything	Entzun gabe nago; ez naiz ezer egiten sentitzen
I broke the tie cord for my sack.	Nire zakuarentzako lokarria hautsi nuen.
I overate	Ni overate
I drank too much whiskey	Whiski gehiegi edan nuen
I drank too much	Gehiegi edan nuen
Silver spoon	Zilarrezko koilara
wooden spoon.	zurezko koilara.
when you get there be sure to introduce yourself to the missionary	iristen zarenean, ziurtatu misiolariari aurkeztu diozula
I dressed up and set out for town	Jantzi eta hirira joan nintzen
when I bathe I dry myself	lehortutakoan
dry yourself well	ondo lehortu
I'm wiping myself as I stand before the mirror	Garbitzen ari naiz ispiluaren aurrean geldirik nagoen bitartean
the baby is asleep holding onto his food	haurra lotan dago janaria mantentzen
the old man is sitting in front of the trading post with his mustache full of food particles	gizon zaharra denda-postuaren aurrean dago, janari-partikulaz betetako bibotearekin
the little boy is scraping mud off of himself with a stone	haurra harri batekin ari da bere buruari lokatza ateratzen
my older sister bawled me out for using her towel	nire ahizpa zaharrenak depilatu egin ninduen toaila erabiltzeagatik
I rubbed myself with a towel when I crawled back out of the sweathouse	Toaila batekin igurtzi nintzen sweathousetik itzuli nintzenean
I told my son to look for the horses before mid-afternoon	Arratsalde erdia baino lehen zaldiak bilatzeko esan nion semeari.
I started to ride across the river but it broke down on us	Ibaian zehar ibiltzen hasi nintzen, baina gurean hautsi zen
I haven't started for my grandmother's yet	Oraindik ez naiz hasi amonarentzat
a hooplike object or wheeled vehicle.)	hooplike objektu bat edo gurpildun ibilgailua).
I put blue paint on myself and my dog didn't recognize me	Pintura urdina eman nion neure buruari, eta zakurrak ez zidan ezagutu
to act with the hand.)	esku hartu).
I took a shower rubbing myself all over with soap	Dutxa bat hartu nuen dena xaboiz igurtzita
I rubbed my entire body with lotion	Gorputz osoa lozioz igurtzi nuen
I have a sore leg so I'm rubbing myself with liniment	Hanka mingarria dut; beraz, leinuarekin igurzten naiz
my leg hurts and it does no good to rub it	nire hankak mina du eta ez du ondo igurzten
I think I can accomplish more	Gehiago lor dezakedala uste dut
I know very well that I can do more	Oso ondo dakit gehiago egin dezakedala
I know very well that I can do more.	Oso ondo dakit gehiago egin dezakedala.
a white man came to our country from Washington and took charge of us	gizon zuri bat etorri zen gure herrira Washingtonetik, eta gure kargu egin zen
when my grandfather died I took over his lands in their entirety.	nire aitona hil zenean, lur guztiak hartu nituen.
when we were nearly home we ran out of gasoline	ia etxean geundenean, gasolinarik gabe geratzen gara
I came back from school because my money ran out	Nire dirua amaitu zelako itzuli nintzen eskolatik
long ago there were many wolves. Now they are on the verge of extinction	aspaldian otso asko zeuden. Orain desagertzeko zorian daude
my grandfather died but we still remember him	aitona hil egin zen, baina oraindik gogoratu gara
I hear that Mr. Long suddenly went blind	Aizu, Long jauna itsua izan zen bat-batean
last summer when we were out herding a bolt of lightning struck nearby and gave us a start	joan den udan, inguruan kolpatutako tximista batekin atera eta hasiera eman zigunean
I was left behind because I was walkíng too slowly	Atzean utzi ninduten, walking mantsoegia zelako
I left Gallup in the afternoon when I went to Phoenix	Gallupetik atera nintzen arratsaldean, Phoenixera joan nintzenean
this morning I ate and took off for Gallup	gaur goizean, jan eta Galluperako atera nintzen
my mother took the name Mary	amak Maria izena hartu zuen
Tall Syphilis adopted the Spanish name Delgadito	High Syphilisek Delgadito izen espainiarra hartu zuen
whenever I get to town I always see this white man begging	hirira iristen naizenean, beti ikusten dut gizon zuri hori eskalaka
when I get old I suppose I'll go around begging among my relatives	zahartzen naizenean, nire senideen artean txikituko naizela pentsatzen dut
I keep myself clean and well groomed every day	Garbi eta ondo zaintzen naiz egunero
I cut myself while I was sawing the plank in two	Plank-a bitan zerratzen ari nintzela moztu nintzen
I weighed myself when I got to school and found that I weighed a hundred and twenty pounds	Pisatu egin nintzen eskolara iritsi nintzenean, eta ehun eta hogei librako pisua aurkitu nuen
I shot a rabbit this morning while I was out herding	Untxi bati tiro egin nion gaur goizean, herding kanpoan nengoela
I was one of those peeling potatoes at school and I cut myself	Ni eskolan borrokatutako aita horietako bat nintzen eta moztu egin nintzen
you cut yourself with a knife	aizto batekin ebakiko duzu
I open the warp and insert yarn in it	Irazkia ireki eta haria sartzen dut
I used blue dye this morning	Tindagai urdina erabili dut gaur goizean
I made myself blue with house paint	Urdina egin nuen, etxeko pinturarekin
today I killed myself with work in planting	gaur landaketarekin hil nintzen
I see that I have a bulge on my car tire	Auto pneumatikoan bulgea dudala ikusten dut
the dough has risen	masa handitu egin da
if one puts dough in a warm place it rises quickly	masa leku bero batean jartzen bada, berehala altxatzen da
I grabbed up just my coat and hurried into the train	Berokia besterik ez nion heldu, eta trenean presaka ibiliko naiz
there are houses strung out along the bank of the river	etxeak daude ibaiaren ertzean
there are lots of pop bottles scattered alongside the road	pop botila asko daude errepidearen ondoan sakabanatuta
he's so shy that he nearly starved to death	bera hain da lotsatia, bera ia gose heriotzara
all my possessions burned up	nire propietate erre guztiak
the church bell is heard ringing	elizako kanpaia entzuten da
I started to ride across the river when the horse fell with me	Zaldia nirekin erori zenean, ibaian zehar ibiltzen hasi nintzen
when the wind suddenly started to blow I put my arms around myself	haizea bat-batean hasi zenean, nire inguruan jarri nintzen besoak
I tried on some shoes in the store	Zapata batzuetan probatu dut dendan
my wife tried on some shoes in the store	nire emaztea dendako zapata batzuetan saiatu zen
I'm teaching myself Spanish	Gaztelania irakasten ari naiz
when I finished eating I started for the waterhole with the sheep	bazkaltzen amaitu nuenean, waterholerako hasi nintzen ardiekin
my mother and father and I went into the meeting and stayed and stayed	nire ama eta aita eta biok joan ginen bilerara, eta geratu eta geratu nintzen
go --- 3 or more actors.	3 aktore edo gehiago joatea.
I really got bored stiff waiting for my father and mother when they went into the store and stayed and stayed while I waited outside	Benetan gogortu egin ninduten, aitaren eta amaren zain, dendan sartu eta geratu zirenean, eta kanpoan zain egon nintzen bitartean gelditu nintzen
he river rose last night	ibaia anoche eraiki zen
when the calf got stranded in the sheep corral its mother called to it in vain from behind the corral	oilagorra ardi-eskortan erori zenean, amak alferrik deitu zion uhalaren atzetik.
a horse that got into the enclosure is still there	barruan sartu zen zaldi bat han dago oraindik
I'm sitting outside waiting in vain for my grandfather who went into the sweathouse and stayed there	Kanpoan eserita nago, aitona sweathouse-n sartu eta han gelditu zen, alferrik.
looking into the mirror I shaved myself	ispiluan begiratuz bizitu egin nintzen
when I looked at myself in the mirror I noticed some gray hair	ispiluan begiratu nuenean, ile gris batez ohartu nintzen
I looked at myself in the mirror and saw that my mustache had grown very long	Ispiluan begiratu eta nire bibotea luzaroan hazi zela ikusi nuen
tomorrow my father is driving a small group of animals to water	Goizean, animalia-talde txiki bat uretara eramaten ari da aita.
everyday my little sister and I make a drive to the waterhole	egunero, nire ahizpa txikiak eta biok bidaia bat egiten dut aintzirara
I've never driven there	Ez dut inoiz han gidatu
count the lambs before I start to take them over there	kontatu arkumeak han jaten hasi aurretik
he did not forsake his people	ez zuen herria utzi
as soon as he finished school he forsook his people	eskola amaitu bezain laster, herria utzi zuen
I reached into the doghouse and it bit me	Doghousera iritsi eta hil egin nintzen
some doors open automatically when a button is pushed	ate batzuk automatikoki irekitzen dira botoi bati bultza egiten zaionean
when I got to his house I rang the doorbell and some woman opened it for me	etxera iritsi nintzenean txirrinak jo eta emakume batek zabaldu zuen niretzat
I brushed myself off with a whisk broom	Whisk erratz batekin garbitu nintzen
I have this rag in my pocket to wipe myself off with while I'm painting the house	Trapu hau poltsikoan daukat etxea pintatzen ari naizen bitartean garbitzeko
when I fell in the mud I sat getting it off myself with a stick	lokatzetara erori nintzenean, makila batez atera nintzen nire buruarengandik
I spent the day yesterday taking part in a stick dice game	Atzo palo dadoen joko batean parte hartu nuen
I played stick dice at my grandmother's place yesterday	Makila jokatu nuen atzo amonaren lekuan
at the Yei Bichei I smeared white cłay on myself and joined in the dancing	Yei Bichei-n, nire buruaz igurtzi nintzen, eta dantzaldian elkartu nintzen
I burned myself taking the ashes out of the stove	Berogailuko errautsak hartuz erre nintzen
I learned to shoot when I was ten years old	Hamar urte nituela tiro egiten ikasi nuen
I'm trying to shoot a deer	Orein bati tiro egiten saiatzen ari naiz
that boy is a good tackler	mutil erasotzaile ona dela
I learned to tackle by playing football at school	Eskolan futbolean jolasten ikasi nuen
I learned to be a batter by playing ball at school	Batter bat izaten ikasi nuen eskolan pilota jolasten
to play monte	mendian jokatu
I'm in jail for adultery	Kartzelan nago adulterioagatik
the cop can't blow his whistle	poliziak ezin du bere txilibitua jo
the teacher saw me when I spit on the floor	irakasleak ikusi ninduen lurrean entzun nuenean
my grandmother chased me out for spitting on the ground near the fire	amonak atzetik jarraitu zidan sutik gertu lurrera botatzeko
I can spit farther than you can	Ahal baino urrutiago entzun dezaket
my grandfather pokes with his cane	nire aitonak kanabera jo du
bumble bees really sting	bumble erle oso xehatuak
I took the pencil away from the little boy because he was jabbing with it	Umearengandik urrun hartu nuen arkatza, bera jabbing zegoen eta.
my sister returned from school very particular about her appearance	nire ahizpa oso berezia itzuli zen eskolatik bere itxurari buruz
ten days ago I built a fence along the side of the road	duela hamar egun hesi bat eraiki nuen errepidearen aldean
I blackened myself with charcoal until I looked like a black man	Ikatzarekin belztu nintzen, gizon beltza iruditu zitzaidan arte.
I had never carried the wand but tomorrow I'll carry it	Inoiz ez nuen makila eraman, baina bihar eramango dut
this morning I put on a sweet smelling cream and took off for school	gaur goizean, usain gozoko krema bat jarri nuen, eta eskolatik kendu nintzen
I put cold cream on myself in the morning before I go to school	Goizean krema hotza jarri nuen eskolara joan aurretik
in the evening I put cold cream on myself and go to bed	gauean krema hotza jarri eta ohera noa
I haven't learned archery yet	Oraindik ez dut archery ikasi
my little sister got mad at me for wiping myself with her towel	nire ahizpa txikia nirekin haserretu zen, toallarekin garbitzeagatik
the trader is always balky when one asks him for money	trader beti da burusoilduna batek dirua eskatzen dionean
why are you so uncooperative?/	zergatik ez zara hain kooperatiboa?/
the kitten got up from its sleep and stretched	katutxoa bere ametsetik esnatu eta luzatu egin zen
this boy runs every morning to harden himself	mutil hau korrika doa goizero gogortzeko
when I go after the bałl I never get it	Bainuaren ondoren noa, inoiz ez dut lortzen
indicator	adierazlea adierazlea adierazlea adierazlea adierazlea adierazlea adierazlea adierazlea adierazlea adierazlea adierazlea adierazlea adierazlea adierazlea adierazlea adierazlea adierazlea adierazlea adierazlea adierazlea adierazlea adierazlea adierazlea adierazlea adierazlea adierazlea adierazlea adierazlea
"little gnats can really ""pinch"""	"gnats txikiek ""pinch""" egin dezakete"""
my little sister really can pinch so for that reason I don't bother her	nire ahizpa txikiak min har dezake, eta horregatik ez naiz gogaitzen
I took the rope away from the little boy because he was lashing it	Soka kendu nion haurrari, taupadak egiten ari zelako
this horse is always flicking his tail	zaldi horrek beti jotzen du isatsa
this rope is too thin	soka hori meheegia da
some skinny white man came to our place	gizon zuri flakoren bat etorri zen gure lekura
my father's racehorse is good only for short distance courses.	Aitaren lasterketa-zaldia ona da distantzia laburreko ikastaroetarako soilik.
my father's racehorse is good only for short distance courses.	Aitaren lasterketa-zaldia ona da distantzia laburreko ikastaroetarako soilik.
my lambs are still small	nire arkumeak oraindik txikiak dira
a microbe is something very tiny	mikrobioa oso txikia da
this rope is too thin	soka hori meheegia da
I have a tic under my eye.	Ikt bat dut begiaren azpian.
school children do not know to what clans they belong	eskolako haurrek ez dakite zer klan diren
everyone should know to what clan he belongs.	denek jakin behar dute zer taldetakoa den.
I had a chest x-ray taken last summer.	Joan den udan hartu nuen toraxaren erradiografia.
there is a white center line running down the highway.	lerro zuri bat dago errepidean barna.
at this time our thoughts turn principally to the sources of our livelihood.	une honetan, gure pentsamenduak gure mantenuaren iturrietara bideratzen dira batez ere.
my beads are the prettiest	nire kontuak politenak dira
I like mutton best of all	Dena baino hobeto gustatzen zait mutton-a
corn is the principal food of the Mexicans	artoa da mexikarren elikagai nagusia
gourd rattle	kalabaza-txintxirrina
rawhide rattle	rawhide-txintxirrina
hoof rattle	hoof sonajero
buffalo rattle	bufalo-zundagina
badger rattle.	teilazko zundagina.
the tracks left by my little sister and brother run side by side here.	nire ahizpa txikiak eta anaiak utzitako pistak albo batera doaz hona.
I snipped off pieces of wire for my father	Frankotiré alanbre-zatiak aitarentzat
I chopped some wood for my grandmother this morning	Zur pixka bat bota nuen amonarentzat gaur goizean
I chopped the backbone into pieces for my mother	Bizkarrezurra zati txikitan moztu nuen amarentzat
I broke the fried bread into pieces for the little boy	Haurrentzako ogi frijitua puskatan puskatu nuen
this is an orphans' home	umezurtzen etxea da hau
the Japanese were defeated and we entered into a treaty with them	japoniarrak garaitu egin zituzten, eta haiekin itun bat egin genuen
when I bought a house from a whiteman I entered into a ten-year payment contract with him	gizon zuri baten etxea erosi nuenean, hamar urteko ordainketa-kontratu batean sartu nintzen harekin
I thought. for sure that my time was up	Pentsatu nuen. nire denbora bazegoen ziur
it's time to pay the house rent and I have no money	etxearen alokairua ordaintzeko ordua da, eta ez dut dirurik
the planting season is over and I haven't finished my planting	ereintza-denboraldia amaitu da, eta ez dut nire landaketa amaitu
I'm running along beside my father.	Aitaren ondoan ari naiz korrika.
there's a windy period in the spring	udaberrian bada aldi zoragarri bat
there's always a rainy period in the fall	udazkenean beti izaten da euria
it's hard to tell how long the war will last	zaila da gerraren iraupena jakitea
last night Mr. Long was doubled up with pain because he couldn't urinate	anoche, Long bikoiztu egin zen minez, ezin baitzuen txiza egin
many years ago the Navajos were rounded up at Fort Sumner	duela urte asko biribildu ziren Navajoak Fort Sumnerren
since my little sister and brother were fighting over an apple I cut it in  half for them	nire ahizpa txikitik eta anaiarengandik borrokan ari ziren etxadi baten gainean gortea erdira beraientzat.
I beat the  wire in twa with a hammer	Alanbrea twan mailu batekin jo nuen
I beat  the log in two (by paunding on it until it broke	Log-a bitan jo nuen (hautsi zen arte kolpatzean
when I found an aspen tree blown over on the road I chopped it apart and dragged it aside	zuhaitz bat bidearen gainean zapalduta aurkitu nuenean, aparte moztu eta alde batera eraman nuen
my grandmother pulled the carded wool apart	amonak artile kardatua baztertu zuen
my mother bawled me out for pulling apart the yarn that she had spun	amak kanpora eraman ninduen berak irututako haria aparte botatzeko
I've caught cold despite the good care I take of myself	Hotza hartu dut, neure burua ondo zaindu arren.
my grandfather will come to see us tomorrow before the morning is out	nire aitona bihar etorriko da gu ikustera, goizean atera baino lehen
we're leaving for Gallup. in the morning	Gallupentzat irteten ari gara. goizean
we got rain this morning.	Euria egin genuen gaur goizean.
we'll take off by plane in the morning tomorrow.	bihar aireratuko gara hegazkinez.
Magellan was reportedly the first person to sail around the world	Magellan munduan nabigatzen lehena izan zen, ustez
I got back together with my hunting companion at noon	Nire lagun batekin itzuli nintzen eguerdian
my wife and I separated last year but she wrote a letter suggesting that we get back together	nire emazteak eta biok joan den urtean banandu ginen, baina berak gutun bat idatzi zuen, elkartuta gaudela iradokitzeko
let's meet at the spring at noon	udaberrian bilduko gara eguerdian
my father and my older brother are equally fast.	nire aita eta anaia zaharrena ere azkarrak dira.
your younger sister and I became acquainted with each other	zure ahizpa txikia eta biok elkar ezagutu genuen
I think I've already met you	Uste dut aurkitu zaitudala
your older brother and I know each other	zure anaia zaharrena eta biok elkar ezagutzen dugu
my girlfriend and yours are one as ugly as the other	nire neska-laguna eta zurea besteak bezain itsusia dira
when I hit their heads together the kittens got into a fight with each other	burua elkarrekin jo nuenean, katutxoek borroka batean lortu zuten elkar
the Red House and Mountain Cove People are not interrelated	Etxe Gorria eta Mountain Cove Jendea ez dago erlazionatuta
I'm really fed up with bills now.	Benetan nazkatuta nago orain.
I spent yesterday weaving	Atzo ehuntzen eman nuen
I  don't know how to weave	Ez dakit nola ehizatu
my grandmother taught me to weave	amonak ehuntzen irakatsi zidan
I didn't do it. I'm  not guilty. I'm not to blame	Ez nuen egin. Ez naiz erruduna. Ez naiz erruduna
I wanted to get all the corn in before Sunday  but I'm not going to make it	Igande aurretik lortu nahi nuen arto guztia, baina ez dut lortuko
in the morning my father eats  and drives off to work while we are still asleep	goizean, aitak jan eta lanera eramaten du lo gauden bitartean.
a retirement party  was held for the former Superintendent	erretiro-festa bat egin zen superintendente ohiarentzat
did you learn typing by taking a correspondence course?/	Idazten ikasi zenuen korrespondentzia-ikastaro bat hartuz?/
I make my own moccasins	Nire mokasinak egiten ditut
I can't get my husband to stop  drinking	Ezin dut lortu senarrak edateari uztea
I want to pay up my account in full at the trading post but I can't get it  done	Nire kontu osoa trading postuan ordaindu nahi dut, baina ezin dut lortu
getting drunk here carries a jail sentence.	mozkortu ondoren, kartzela-epaia eman du.'
it is impossible to crawl through this fence.	ezin da hesi horretatik ibili.
five years ago a tunnel was bored through the mountain and now there's a road in there	duela bost urte, tunel bat aspertu egin zen mendian, eta orain errepide bat dago han.
my father punched a hole in my ears for me	nire aitak zulo bat zulatu zuen belarrietan niretzat
last night a hole was punched in my car tire.	zulo bat zulatu zuten nire autoko pneumatikoan.
among the scrub oaks	sasietako haritzen artean
I went among the Navajos	Navajos
I distributed them to them	Haiei banatu nituen
you're among	hemen zaude:
he's among	bere artean
he is among	bere artean
we're among	gure artean gaude
you're among	hemen zaude:
I take part in everything.	Edozertan parte hartzen dut.
we're under the covers together	estalkipean gaude, elkarrekin
we're sitting under the same cover	estalki beraren azpian eserita gaude
the wagon took me through the mud down in the wash	orgak buztinetik behera eraman ninduen garbitzean
the rope fell out of the car	autotik erori zen soka
the deer	oreina
