my rope was too short so I fastened a piece of wire to it and pulled some water up from the well	nire soka laburregia zenez, alanbre-zati bat jarri nion hareari, eta ur pixka bat bota nuen putzutik gora.
when I moved the log a lot of black ants came streaming out	log mugitu nuenean, inurri beltz asko korrika atera ziren
I moved the tree and the nuts fell	Zuhaitza mugitu eta intxaurrak erori egin ziren
when I moved the deer saw me	oreina aldatzean ikusi ninduen
I have a chest pain whenever I move	Bularreko mina dut mugitzen naizen bakoitzean
my muscles were so sore last night that I could not move until dawn	nire giharrak hain mingarriak zirenez, egunsentira arte ezin nintzen mugitu
we got down by going sideways in a lateral rock crevice	alboko arrokako arraildura batetik jaitsiko gara
I'm going to town in the late afternoon	Arratsaldean joaten naiz hirira
it was late in the afternoon yesterday when I got back to Winslow by train	berandu izan zen atzo arratsaldean Winslowera trenez itzuli nintzenean
the little pigs are sleeping as they lie with their bodies partly in the mudhole	zerriak lotan daude gorputzak zuloan daudela
I was charging a car battery when it exploded on me	Auto-bateria bat kargatzen ari zen nire barruan eztanda egin zuenean
with his breath the creator brought man to life	bere arnasarekin, sortzaileak gizakia ekarri zuen bizitzara
to fall into the dirt one after another	zikinkerian erortzea, bata bestearen atzetik
to sink to the bottom one after another	hondoratzeko, bata bestearen atzetik
how much do you get a year? What's your annual income?/	zenbat eskuratuko duzu urtebete? Zein da zure urteko diru-sarrera?/
the people who live along the railroad work hard	trenbidean bizi diren pertsonek gogor lan egiten dute
those of us who live off the reservation know nothing of the things that are discussed in meetings at Window Rock	Erreserbatik kanpo bizi garenok ez dakigu ezer Window Rock-eko bileretan eztabaidatzen diren gauzez.
I had nearly made it to my grandmother's place hobbling on crutches when I slipped	Amonaren hobbling-era eraman ninduen ia, makuluetan irristatu nintzenean
I wriggled up to the brink of the wash and ran down into it	Garbiketaren ertzeraino idatzi nuen eta beherantz egin nuen bertan
the baby was born dead	umea hilda jaio zen
with me feeding it small quantities of milk the lamb lived	nirekin, arkumeak bizi izan zuen esne kantitate txikiak jaten
I'm waiting to get the news	Berria lortzeko zain nago
I'm waiting for the baby	Haurraren zain nago
I want to take a picture of the little boy so I'm waiting	Haurraren argazkia atera nahi dut; beraz, zain nago
as we were paddling around in the boat I tore pages from a book and tossed them one after another into the water	inguruan arraun egiten ari ginela, liburu bateko orriak egin nituen eta bata bestearen atzetik uretara bota nituen
I tossed the flowers into a box and tied it	Loreak kaxa batean bota eta lotu nituen
I cut the wheat this morning	Garia gaur goizean moztu nuen
I trim my toenails but it doesn't take them long to grow back	Moztu nire azazkalak, baina luzaroan hazten
I packed up all the tin cans and bottles that lay scattered around my place and hauled them away out of view	Nire lekuaren inguruan sakabanatuta zeuden lata eta lata botila guztiak paketatu eta bistatik kanpo eraman nituen
let's break off some oak for the sheep	haritz bat apurtuko dugu ardientzat
she broke off five ears of corn and roasted them for us	berak bost arto-ziri hautsi eta guretzat erre zituen
to take them into town one after another	hirira eramateko, bata bestearen atzetik
to bury them one after another	bata bestearen atzetik lurperatzeko
set my hat up for me!	jarri nire txapela gorantz niretzat!
Crooked Mouth.	Aho okertua.
you can have all the horses in excess of six head	zaldi guztiak sei burutik gora izan ditzakezu
I got homesick at school so I simply went back home	Homesick-ak ditut eskolan; beraz, etxera itzuli nintzen
it was along toward midnight last night when I became nervous	joan den gaueko gauerdialdera joan nintzen urduri jarri nintzenean
I was going on a job to California but I couldn't find anyone to take care of the cattle so I cancelled it	Ni lan batean nengoen Kaliforniara, baina ezin izan nuen inor aurkitu ganadua zaintzeko; beraz, bertan behera utzi nuen.
seeing pus is repulsive to me	niretzat, zornea ikustea aldaragarria da
I got the willies when I climbed to the rim of Canyon de Chelley	Willie-ak lortu nituen Chelley-ren arroilaren ertzera igo nintzenean
this hogan is contaminated	sua kutsatuta dago
sometime ago lightning struck a tree near the hay shed so it is contaminated for us	duela denbora bat, tximista batek zuhaitz bat jo zuen belarraren estalpean; beraz, kutsatuta dago guretzat
I hoed for two days in the field but I didn't make much progress. Only when my grandson came to help me did the end of the job come into view	Mendian bi egunez jan nuen, baina ez nuen aurrerapen handirik egin. Iloba laguntzera etorri zitzaidanean bakarrik ikusi dute elkar
I ate a melon and it gave me a bellyache	Meloi bat jan eta bibote bat eman zidan
when I ate a green apple it gave me a bellyache	sagar berdea jan nuenean biguna eman zidan
from now on the weather will be cold	hemendik aurrera hotza izango da
I'm going to be the first one in line at chow time at school	Eskolako lehena izango naiz chow time linean
since my job is far away I seem to be just putting off farming my land	nire lana oso urrun dagoelako Lurra bota berri dudala iruditzen zait
we say we'll move to the mountains when the weather warms up but it seems it'll be some time yet before we move	klima berotzen denean, mendietara joango garela esaten dugu, baina badirudi mugitu aurretik izango dela.
I spaded up my front yard because I want to put in a lawn	Aurreko patioa entzun nuen belar batean jarri nahi dudalako
for it. Lit. to scratch or paw an area	horretarako. Argiztatua. eremu bat arraspatzeko edo prestatzeko
I haven't cleaned up the kitchen yet	Oraindik ez dut sukaldea garbitu
by shouting you scared the baby	haurra izutu zuen
the only way to get to the mountains in the wintertime is by wagon -- a car can't make it	neguan mendietara heltzeko modu bakarra gurdia da - auto batek ezin du egin
I borrowed a car as a means of transportation to Fort Defiance	Fort Defianceri autoa utzi nion garraiobide gisa.
tomorrow there'll be transportation to the mountain in my car	bihar mendi-garraioa izango dut nire autoan
there is no way to get there --- no transportation	ez dago hara iristeko modurik -- ez dago garraiorik
the area is rocky	eremua arrokatsua da
I talked so long at the meeting that the people got annoyed with me	Hainbeste denbora eman nuen bileran jendea nirekin gogaitu zela
the trains in Gallup are an awful annoyance	trenak Gallupen eragozpen izugarria dira
when the bear attacked the boy he fought back with a stick in the hope	hartzak esperantzan makila batekin borrokatu zuen mutilari eraso egin zionean
they're putting me in jail but even so I have hope	kartzelan sartzen ari zaizkit, baina hala ere itxaropena dut
I had a hard time planting the corn all by myself.	Artoa nire kabuz landatzea asko kostatu zitzaidan.
I really feel for those who are suffering.	Benetan sentitzen naiz sufritzen ari direnengatik.
r. Long puts on an act saying he hasn't any sheep.	r. Egintza batean, Longek esan du ez duela ardirik.
the sheep corral has got to where it stinks something awful	ardi-eskortak zerbait beldurgarria du
we all have cars	denok ditugu autoak
I enjoyed a good Yei Bichei	Yei Bichei on batez gozatu nuen
a bicycle was bought for my little brother so he's riding it around and having fun with it	bizikleta bat erosi zioten nire anaia txikiari; beraz, hura inguruan dabil eta harekin dibertitzen da
I castrated the lamb yesterday but he's still in pain	Arkumea atzo lastatu nuen, baina oraindik minduta dago
my burro is standing over there on the shady side	nire astoa zutik dago han, alde ilunean
I buried the keys on the shady side of the hogan	Giltzak suaren alde ilunean lurperatu nituen
I planted some flowers around my house but they didn't grow well on the shady side	Lore batzuk landatu nituen nire etxearen inguruan, baina ez ziren ondo hazten alde ilunean.
I built a fire in the hogan and it soon got warm inside	Sua egin nuen sutan, eta berehala berotu zen barruan
I get drunk easily I don't have much capacity	Mozkortuta nago Ez dut gaitasun handirik
when my little brother ran a nail into his foot he was taken to the hospital before it started to hurt	nire anaia txikia iltze bat korrika zihoala ospitalera eraman zuten min hartzen hasi baino lehen.
when I chewed plug tobacco it made me dizzy	tapoi-tabakoa mastekatu nuenean, zorabiatuta egin ninduen
I got dizzy painting the interior of my house	Nire etxe barrua margotu
when I returned last night I had a hard time heating up the hogan	anoche itzuli nintzenean, denbora gogorra izan nuen sua berotzen
this man smokes so much that he smells like tobacco	gizon honek hainbeste usain eta tabakoa erretzen ditu
I came here two months ago	Etorri hona duela bi hilabete
let's run a race and see who wins	lasterka joango gara eta nork irabazi duen ikusiko dugu
my grandfather's ninety years old but he still gets around pretty well ---- he's still frisky	laurogeita hamar urteko aitonak, baina oraindik ere nahiko ondo lortzen du ---- oraindik frisky-a da.
my grandfather is ninety years old but he's still spry	nire aitonak laurogeita hamar urte ditu, baina oraindik badago
his father scolds him but the lesson he learns lasts only a short time	aitak ureztatu egiten du, baina ikasten duen ikasgaiak gutxi irauten du.
my cousin kept running away from school and he didn't learn his lesson until he nearly froze to death	lehengusuak eskolatik ihesi jarraitu zuen, eta ez zuen ikasgaia ikasi hil arte izoztu zen arte
to pour it.)	botatzeko).
the area behind the building that is under construction is a junky mess	eraikitzen ari den eraikinaren atzeko aldea kaosa da
there's no room for me in there	ez dago lekurik niretzat han
the schoolchildren get good food at school so their belts keep getting larger	ikasleek janari ona lortzen dute eskolan, eta, beraz, beren gerrikoak handiagoak izaten jarraitzen dute.
my grandfather's land is bounded on the east side by the highway.	Errepideak mugatzen du nire aitonaren lurra ekialdean.
on this side there's a shaft into the mountain	alde horretan, ardatz bat dago mendian.
this log has a hole in its side	erregistro horrek zulo bat du bere ondoan
stone or rock hogan	harria edo arroka sua
lumber hogan.	egurrezko sua.
I was sitting in the hogan and started outside when I had a dizzy spell and blacked out	Ni etxean eserita nengoen eta kanpoan hasi nintzen sorginkeria zorabiagarria nuenean eta kanpora blackatzen nituenean
since I work everyday there's no one at home at my place	egunero lan egiten dudanetik, etxean inor ez dago nire lekuan
don't keep your place unattended	ez eduki zure lekua etorri gabe
it's empty. No one's home	hutsik dago. Inoren etxea
I shall always remember you with this ring	Eraztun honekin gogoratuko zaitut beti
the sun will shine always	eguzkiak distira egingo du beti
sometime ago I had tuberculosis. Then I thought I was well but I found out I still had traces of it	duela zenbait urte tuberkulosia izan nuen. Orduan ondo zegoela pentsatu nuen, baina konturatu nintzen oraindik ere bazuela arrastorik.
the house was jarred when lightning hit nearby	izpi batek gertu jo zuenean zegoen etxea
jar.)	jar).
as a result of the high food prices my account at the trading post is gaining on me	elikagaien prezio altuen ondorioz, saltokiko nire kontua irabazten ari da
last night during the rainstorm things kept lighting up as the lightning flashed	anoche ekaitzak iraun zuen bitartean, gauzak piztuta eduki ziren tximistak dir-dir egiten zuen bitartean.
it was still daylight when I drove the sheep back into the corral and set out dog food for my sheep dogs	oraindik eguneko argia zen ardiak eskortan eraman eta nire ardi txakurrentzako janalditik kanpo jarri zituenean
it's raining there along the mountainside	euria ari du mendian barrena
there's a rainstorm moving along the foot of the mountain	mendian zehar mugitzen den euria dago
there was a period during which the Navajos were raiders	garai batean Navajoak inbaditzaileak ziren
it's my turn now	nire txanda da orain
the ball game is half over	pilota-jokoa erdi-mailakoa da
we're living nicely as time goes on	ondo bizi gara denborak aurrera egiten duen bezala
I'm just visiting around today	Gaur bisitatzen ari naiz
I slept outside with my back to the fire last night.	Kanpoan egiten zuen lo, eta nire bizkarra anoche sutan.
the boy's tooth quit aching before he got to the doctor	haurraren hortzak min izateari uzten dio medikuarengana iritsi aurretik
he scolded his son because the boy lost some sheep	semea moztu zion, haurrak ardi batzuk galdu zituelako
the boy got a scolding from his father for stealing	mutilak aitaren oparia lortu zuen lapurreta egiteagatik
I was expelled from school for breaking the rules	Eskolatik bota ninduten arauak hausteagatik
he committed the crime of murder	hilketa egin zuen
my dooryard is hard-packed	nire patioa hard-bildua dago
there's a real scarcity of traditional baskets now	benetako otar-eskasia dago orain
reportedly meat is in short supply in Japan	Txostenaren arabera, haragia hornidura laburrean dago Japonian
a couple of years ago there was a gasoline shortage everywhere	duela pare bat urte, nonahi zegoen gasolina-eskasia
the Navajos  say that stock reduction was a fright	Navajosek dio stockaren murrizketa sustoa izan zela
the  report of another outbreak of fighting overseas frightened me	atzerriko beste borroka-agerraldi baten txostenak izutu egin nau
Mr. Long is so lazy that all of his sheep strayed away and disappeared	Long jauna hain da nagia bere ardi guztiak urrundu eta desagertu egin zirela
my son is always lazy in the summertime	nire semea beti nagia da udan
my grandfather doesn't see well.	aitonak ez du ondo ikusten.
when I become Superintendent I'll administer Navajo affairs in accordance with Federal programming	Superintendentea izatera iristen naizenean, Navajoren gaiak administratuko ditut, programazio federalaren arabera
here at Window Rock we leaders do our own planning	hemen, Window Rock-en, geure plangintza egiten dugu
people who put things off usually get far behind	gauzak normalean jartzen dituzten pertsonak oso atzean geratzen dira
I'm still putting off the visit I promised to make to you	Zuri egingo nizun bisitatik kanpo ari naiz oraindik
this patient is worse now because you kept putting off the visit you were to make with him to the doctor	Gaixo hori are okerragoa da orain, medikuarengana egin behar zenuen bisitatik kanpo utzi zenuelako.
I was sitting in the barroom when my wife and daughter came running in and they dragged me out despite my resistance	Egongelan eserita nengoen, emaztea eta alaba korrika etorri eta herrestan eraman nindutenean, nahiz eta nire erresistentzia izan
we re-elected our leader so he could carry on for us	gure liderra berriz hautatuko dugu, aurrera egin dezan
I got enough beer	Nahikoa garagardo dut
I drank a lot of beer and I got enough of it	Garagardo pila bat edan nuen eta nahikoa dut
his body was smashed when the car fell on him	autoa erori zitzaionean, gorputza hondatu egin zitzaion
the baby is weak from fever.	haurtxoa ahula da, sukarra dela eta.
school construction among us came to be desired	gure artean eskola eraikitzea nahi izatera iritsi zen
he was tried in court yesterday and found guilty	atzo epaitu zuten gortean, eta errudun deklaratu zuten
Mr. Long was tried in Chinle for battery on his wife	Long jauna Chinlen probatu zuten bateriarako emaztearentzat
schools will be discussed today when the Council meets	eskolak gaur eztabaidatuko dira Kontseilua biltzen denean
I squeezed my girl and she let out a yell	Nire neskak zukua atera zidan eta berak yell bat utzi zuen
I broke the limbs off a little dead pinetree	Hildako pinetree txiki baten gorputz-adarrak hautsi nituen
at high noon light usually shines down into the well.	eguerdian, argiak normalean beherantz egiten du putzuan.
Hitler make himself the leader of the German people	Hitler alemaniar herriaren buru bihurtu da
the witch turned himself into a wolf.	sorgina otso bihurtu zen.
I still think of myself as	Oraindik nire buruaz pentsatzen dut
when my older sister got back from school she was so haughty her aunt and cousin tried to ask her questions but without result	nire ahizpa nagusia eskolatik itzuli zenean, izeba bihurria zen, eta lehengusinak galderak egiten saiatu zen, baina emaitzarik gabe
my grandfather came in on me and sat down	nire aitona nigana etorri zen eta eseri egin zen
when I got tired I lay down under a tree and went to sleep.	nekatu nintzenean, zuhaitz baten azpian etzan eta lotara joan nintzen.
I have water piped into my house	Ura etxean sartuta daukat
half and half wings moth	hego ertain eta erdikoa, polila
pink moth	arrosa arrunta
blackish moth	polila beltzaxka
sparkling moth	Suge distiratsua
furry moth	txortena
blue moth	polila urdin
water scum moth	scum polla ura
greasy moth	koipe-ziria
striped moth	arraildura
little moth	Azpil txikia
speckled moth	beso pikarta
mottled brown moth	txita marroi pikarta
big moth	txortena handia
big dark moth	ilunpe handia
striped big moth	Arraildura handia
gray big moth	gris handia, polila
spotted gray big moth	moth handia, gris orbandua
spotted big moth	txuleta handia
black big moth	beltza, polipolipoltxa handia
blackish big moth	ilunpe handia
slender moth.	txorten liraina.
to get snowed in	elurra egiteko:
I rode the horse into the water and found that it was really deep.	Zaldia uretan sartu eta benetan sakona zela ikusi nuen.
every evening my father drives his car into the garage	gauero, aitak garajean gidatzen du autoa
to go away and disappear	joan eta desagertu
there's supposed to be a movie at the school tonight.	pentsatzen da film bat dagoela eskolan gaur gauean.
the Budget Committee meets next week	Aurrekontuaren Batzordea datorren astean bilduko da
me we finished building the house.	etxea eraiki berri dugu.
he threw his knife and it stuck in the tree	labana bota eta arbolan itsatsi zuen
a piece of wood stuck in his hand when he fell off the horse	zaldiz erori zenean, eskuan itsatsitako zur-zati bat
I hope no nail pierces any of our tires	Gure pneumatikoetako edozein iltze ez zulatzea espero dut
the woman stuck her finger with a needle while she was sewing.	emakumeak, josten ari zela, atzamarra orratz batekin jo zuen.
I found the cheese infested with black ants	Inurri beltzekin inurritutako gazta aurkitu nuen
I found that the piece of meat that was sitting in the hogan was infested with worms	Etxean eserita zegoen haragi-zatia zizarez josita zegoela ikusi nuen
he's going along in the truck with a load of lumber that's just about to fall off.	kamioian barrena doa, itzaltzear dagoen egurrezko karga batekin.
I entered the horse corral on my horse and dismounted	Nire zaldian sartu nintzen, ziztu bizian
the feather floated away through the air	lumak airean flotatu zuen
when my little brother was riding a bucking burro he rode it bucking around the corner of the building	Nire anaia txikia bucking asto bat muntatzen ari zela, bucking jarri zuen eraikinaren izkinaren inguruan
at the War Dance my older brother was riding a bucking horse and he rode it away behind the brush shelter where food was prepared.	Gerra-dantzan, nire anaia zaharrena zaldiz betetako zaldi bat muntatzen ari zen, eta janaria prestatzen ari zen aterpetxetik urrundu zuen.
I was among those who took the emetic at the ceremony.	Ni enetika zeremonian hartu zutenen artean nengoen.
to become the middle of the winter	neguko ingurune bihurtzeko
a large nail went into my tire	azazkal handi bat sartu zen nire pneumatikoan
the water flowing from beneath the rock trickles down into the wash.	arrokaren azpian dabilen ura beherantz irristatzen da garbitzean.
I milk my goat two times a day because it doesn't take long for her milk to accumulate..	Esnea egunean bitan ahuntzen dut, esnea pilatzeko denbora asko behar duelako...
the belt was carried off from our place.	gerrikoa gure lekutik kanpo eraman zuten.
I chased my horse off last night	Anoche zaldiaren atzetik ibili ziren
my grandfather rode over the hill and disappeared from sight	nire aitona muinoaren gainean zamalkatu eta ikusmenetik desagertu zen
I rode my burro in last night or last night my burro came in on me	Puse mi burro en anoche o anoche mi burro entró en mí
to flow away and disappear.	jariatzea eta desagertzea.
your teacher	zure irakaslea
his teacher	maisua
our teacher	gure maisua
that is this man's name	gizon honen izena dela
that became my name when I was still small	oraindik txikia nintzela nire izen bihurtu zen
the crow took off when he saw me	belea kendu egin zen ikusi nuenean
a cloud appeared above us and then raced away.	hodei bat agertu zen gure gainean, eta gero korrika egin zuen urruti.
yesterday I towed my older brother's car into the repair shop	atzo eraman nuen nire anaia zaharrenaren autoa konponketa-lantegian
I dragged away a horse that I found that was run over by a car on the highway.	Errepidean auto batek harrapatu zuen zaldi bat arrastatu nuen.
to step in quietly	isilik
the little boy stepped quietly into the hogan and ate a cookie.	haurra lasai sartu zen etxean eta galleta bat jan zuen.
I did the laundry for my grandmother this morning	Garbitegia amonarentzat egin dut gaur goizean
that boy had a ceremony because he  is reportedly subject to fits	Zeremonia izan zuen haurrak, doikuntzei lotuta dagoela jakinarazten diotelako
take care of your moccasins and don't lose them!	zaindu zure mokasinak eta ez galdu!
to sink it	hondoratzera
I lead my father's horse into the horse corral for him in the evening.	Aitaren zaldia zaldi-uhalera eramaten dut gauean.
last night I couldn't get to sleep right away	Ezin izan dut lokartu
don't forget that I put the stew on the stove.	ez ahaztu berogailuan jartzen dudala gisatua.
we drove pegs into the roadway	larakoak bidean eramaten ditugu
my grandmother didn't like it when I snapped her picture as she was grinding	nire amona ez zitzaidan gustatu argazkia ipintzean
I always shift gears going up hill	Beti aldatzen dira engranajeak muinoa igoz
I carried off my mother's purse and hid it in the hen house.	Amaren poltsa atera eta oiloan ezkutatu nuen.
I can't swallow my medicine because I have such a sore throat	Ezin dut botika irentsi eztarriko min hori dudalako
take one of these pills every hour	pilula hauetako bat hartu orduro
take these pills with water.	hartu pilula hauek urarekin.
I took some mud into the hogan	Lokatz pixka bat hartu nuen etxean
I was going to take some mud into the hogan but my grandmother said not to do so	Lokatz pixka bat hartu behar nuen etxean, baina amonak ezetz esan zuen.
the boy stumbled on a stone and went head over heels	haurrak harri batekin egin zuen topo, eta burua izan zen orpoen gainean
my father put me on the horse but I fell off	aitak zaldian jarri ninduen, baina erori egin nintzen
I was helping my older brother build a hogan when I fell	Anaia zaharrenari, erori nintzenean, su bat eraikitzen laguntzen ari nintzen
when the whirlwind got close I ran for the hogan and darted inside	zurrunbiloa hurbildu zenean korrika egin eta barruan ilundu zen
last night in the snowstorm I had a flat tire and some white man helped me	anoche elur-ekaitzean pneumatiko lau bat izan nuen, eta gizon zuri batek lagundu zidan
I wish somebody would help me	Norbaitek laguntzea nahi dut
when my car broke down on me I spent the night in it because there was no one to help me	nire autoa nigan puskatu zenean, gaua bertan eman nuen, laguntzeko inor ez zegoelako
when I was x-rayed at the hospital the doctor told me to inhale	ospitalean erradiografiatuta nengoenean, medikuak arnasteko esan zidan.
when I hauled the barrel of water I rolled it into the brush shelter and covered it with a tarpaulin	ur-upela garraiatu nuenean, eskuilaren babeslekuan bildu eta olana batez estali nuen.
Mr. Nez always beats his wife when he drinks	Nez jaunak beti jotzen du emaztea edaten duenean.
one shouldn't beat his wife.	batek ez luke emazteari irabazi behar.
I voted for Mr. Tso	Tso jaunaren aldeko botoa
we entered the dining hall but found it to be full	jangelan sartu ginen, baina beteta zegoela iruditu zitzaigun.
the telephone line runs into the trading post.	telefono-linea trading postuan exekutatzen da.
the trader has a goiter	traderrak goiter bat du
the wind didn't let up until midnight	haizeak ez zuen gauerdira arte utzi
the wind blew my hat away from inside the train	haizeak nire txapela trenetik urrun jaurti zuen
I picked up the paper but it blew back down	Papera jaso nuen, baina behera egin zuen hegan
the rainstorm reached us from the foot of the mountain.	euria menditik etorri zitzaigun.
you can get a good price for mutton back east	prezio ona lor dezakezu ekialdeko itzulerako muttonerako
this car isn't worth a damn!	auto honek ez du merezi madarikatu bat!
you will eat only after you've washed your hands	eskuak garbitu ondoren bakarrik jango duzu
yesterday was the first time that I ever drove a tractor.	atzo erabili nuen lehen aldiz traktore bat.
we'll wait and see what the place looks like	itxaron, eta ikusi nolakoa den lekua
we'll wait and see how much it's worth	itxaron eta ikusi zenbat merezi duen
we'll wait and see who wins	itxaron eta ea nork irabazten duen
the circus hasn't come to town yet	zirkoa oraindik ez da iritsi hirira
I was one year old when my family moved to Chinle	Urtebete nuen nire familia Chinlera joan zenean
I'll give you a sheep when you've given me the money and not before.	Ardi bat emango dizut dirua eman didazunean eta ez lehenago.
before winter comes we come down off the mountain	negua iritsi baino lehen menditik jaisten gara
when it gets dark the baby starts to cry	umea ilundu eta negar egiten hasten da
